Israel,"Apart from specific debates about ongoing activities, there is no public debate regarding how national STI policy is governed.","The main policy debate regarding support for public research relates to the components of the research funding model for Israel's research universities, including how the model can be optimized in order to promote excellence in research.","Government support for business innovation and innovative entrepreneurship in Israel was traditionally comprised mostly of R&D direct incentives, namely grants. This policy was very successful in increasing the national expenditure on civil R&D in recent decades. Additional policy tools such as the Yozma venture capital funds (where the government was a co-investor) and the technological incubators helped boost the tech entrepreneurship ecosystem. 

Today, the Israeli tech ecosystem is thriving and is enjoying a record amount of private investment in R&D and in venture capital. This raises the question whether government direct incentives for business R&D are still as relevant as they used to be. The government has created other support tools in the meantime - especially for investing in human capital (described in this survey), but legacy R&D support tools are still in place. Many acctors in the government and industry hold the opintion that government support for R&D is still critical to keep Israel's global competitive position, while other emphasize the importance of greater government focus on regulation and ease of doing business for the tech industry as a first best policy.","In Israel, science-industry knowledge transfer is carried out mainly through Tech Transfer Offices (at least in patentable research fields such as life sciences. In software there are more available channels). The applicative research institute model is much less common. Recently, many have expreseed doubts regarding the extent TTOs engage with the local industry, especially in young technological ecosystems in Israel, where it's easier for them to work with established foreign corporations compared to local startups. Therefore, the government has been working on re-designing incentives for TTOs in order to increase their engagement with the local industry and increase their outputs in general.

A second and parallel issue is applicative or translational research in emerming technologies such as biotechnology, nanotechnology etc. This also affects the pipeline of innovation assets the TTOs are able to offer the industry, of course. It seems the incentives for university researchers to engage in applicative research that may benefit the industry are sub-optimal. This is an important debate especially in biotech for healthcare, as the Israeli academia has been producing world-leading research outputs, that are rarely translted to industrial innovation in Israel.The Bioconvergence strategic plan described in this survey deals will deal also with this issue.","The shortage of technology professionals in Israel represents a challenge to the high-tech sector and to the Israeli economy as a whole. The high-tech sector is the main potential driver of growth in the Israeli economy, and a central asset in it has always been digital R&D talent. However, future growth will be challenged if the country’s supply of digital R&D talent does not grow. 

High-tech companies are struggling to find technology professionals at the moment – this affects mostly Israeli companies (startups & growth), as multinationals are able to offer higher salaries and recruit the best talent. According to a recent survey, there are around 15,000 technological positions in the Israeli high-tech industry – about 5% of total employment and 10% of technological positions in that sector. This shortage reflects, on the one hand, the rapid growth of the Israeli tech ecosystem, especially in ICT, which creates ever-growing demand for human capital. On the other hand, it reflects an insufficient supply of university graduates over the last decade.

Key questions are:

-	How to increase the supply of quality graduates entering the workforce (from academia or other training frameworks), and how to best prepare them for actual R&D work?

-	How to create training schemes that suit the dynamic nature of the high-tech industry? New professions are created faster than the ability to train for them. One example is data scientists. The rapid growth in the field of AI in the high-tech sector, as well as accelerated digitisation in other fields such as the health industry, are creating an increasing need for skilled professionals. The worldwide demand for data scientists grew by 650% in 2012-2017. 

The Israeli government is coordinating efforts to expand the supply of personnel skilled in all high-tech fields by increasing the number of students pursuing high-tech related disciplines in universities, by establishing a variety of extra-academic paths into the industry, by opening channels to recruit skilled personnel from overseas, and by encouraging the study of math and science in schools. Within these efforts, emphasis is being placed on integrating women and underrepresented populations in high-tech sectors (Arabs and Ultra-Orthodox Jews in particular), with a recognition of the unfulfilled potential in these groups.

The results can already be seen on the ground. On the academic front, the number of ICT students comprised 26% of the student body pursuing bachelor’s degrees in 2018, demonstrating a significant spike in this field. In the extra-academic sector, there has been an increase in elite training for high-tech professions due to, among other reasons, the Israel Innovation Authority launching an incentive programme for coding bootcamps. The Authority will also soon launch an on-the-job support tool for R&D. Furthermore, with the objective of increasing resources by attracting overseas talent, the government has created a Green Track for foreign high-tech professionals.","On a national level, an inter-ministerial project for promoting “SDG tech”, with an emphasis on developing countries as target markets, is currently in process. In addition, the Ministry for Environmental Protection and the Ministry of Foreign Affairs are preparing to adopt the SDGs and to report to the UN on their progression.

The Israel Innovation Authority operates a dedicated division for societal challenges. Since 2017, the Societal Challenges Division focuses on harnessing technological innovation to solve substantial problems in society and the public sector in Israel and worldwide, as well as on developing solutions for the lack of skilled workers in the high-tech industry by increasing the number and variety of employees in this sector. In 2018, the division assembled all of the incentive programmes in these fields under one strategic umbrella of “tech for impact” (the Digital Innovation for Public Challenges programme, Assistive Technologies programme, and Grand Challenges Israel). The programmes were updated accordingly, adding specific impact measurement criteria related to the SDGs. Comprehensive marketing activities were also carried out, together with an array of partners from across the ecosystem, to expand the target audience, increase the scope and quality of the initiatives requesting backing, and focus entrepreneurs in the field on the significant challenges outlined in calls for proposals.",
Italy,"Italian STI policy governance cannot be set apart from what is discussed and negotiated in the European Union and at other international fora. For example, environmental issues, in terms of climate changes, biodiversity, and sustainable agriculture, are important points of discussion, as is sea pollution. Technological innovation, digitalisation and the Next Production Revolution (NPR or Industry 4.0) are also priority topics.

The Ministry of Education, University and Research produced the National Research Plan (NRP) for the period 2014-2020 that elaborated 12 action areas and defined five thematic priorities, as follows:
1.	Aerospace and Defense;
2.	Health, nutrition, quality of life;
3.	Intelligent and sustainable industry, energy and the environment
4.	Tourism, cultural heritage and creativity industry;
5.	Digital Agenda, Smart Communities, infrastructures and intelligent mobility systems.

STI policy is co-discussed with other ministries, such as the Ministries of Health, of Environment, and of Economic Development, while the Ministry of Foreign Affairs and International Cooperation coordinates international strategy. The Council of Ministries supervises activities at the EU and international levels.","The policy debate is oriented to discuss three main issues at different levels: the national, with the goal of increasing enterprises’ collaborative activity in the field of research and innovation; the European to co-create the next European framework programme for research and innovation; and international to foster Italy's internationalisation of research in terms of researchers mobility, and shared projects and infrastructures. 
Debates are focused at national level with the National Operational Program (PON) Research and Innovation 2021-2027. As for the 2014-2020, the PON is the instrument through which Italy contributes to the improvement of the quality of higher education and to the strengthening of research, technological development and innovation, realizing the objectives of the European Union's cohesion policy in favor of its territorial areas more disadvantaged.

At the international level, ongoing debates resulted in recent years in some relevant outputs, such as the PRIMA and the BLUEMED-EU initiatives, focused on promotion of collaborative research within the Mediterranean countries, including non-EU, in which the Italian commitment in terms of budget and political engagement has been relevant. Other activities such as the debate on the future European framework program of research and innovation Horizon Europe or the dialogue within the “5+5 Science Dialogue initiative” that was presided by Italy in 2018. The Central European Initiative that was presided by Italy in 2019 gave the opportunity for Italy to approach a debate about the role for cooperative research not only within the EU area but also including neighbouring non-EU countries.

Other national debates include the internationalisation of Italian research and higher education (coordinated by the Ministry of foreign affairs) and international cooperation, space exploration and the space economy (coordinated at an inter-ministerial level). All of these issues are discussed at the ministerial level and supervised by the Council of Ministries.","The Italian Government has adopted a set of relevant measures aimed at fostering the creation and growth of its innovative startup (Decree-Law no. 179 of 18 October 2012) and innovative SMEs’ ecosystem (Decree-Law no. 3 of 24 January 2015). An extensive portfolio of incentives was laid out to support innovative startups and SMEs at all stages of their life cycle, from incorporation to expansion and maturity. The need for policies tailored to innovative firms is justified by several public goals. The various measures aim to spur sustainable growth and enhance productivity. An innovation-driven entrepreneurial culture should be spread across the entrepreneurial ecosystem as a whole, including SMEs, large corporations, incubators and accelerators, as well as universities. 

The National Plan Industry 4.0 was adopted in 2016 with the purpose of encouraging and sustaining the digitalisation process of firms through the introduction of fiscal incentives (such as hyper and super depreciation) supporting the purchase of machinery 4.0 and reinforcing – through a tax credit – the level of digital skills. New measures, which are under approval in the Budget Law 2020, will give continuity to these recently introduced fiscal incentives, with the novelty of a wider time horizon. Following the approach of the 2019 Budget Law, the measures will continue to favour particularly micro and small firms. Special attention will be given to innovation in value chains with relation to new technologies and digitalisation.","Debate on science-industry knowledge transfer and sharing is active at national level, at bilateral and trilateral levels, and within international working groups in Italy.

The Ministry of Economic Development has defined the “Impresa 4.0” National Plan (formerly Industry 4.0) to support companies, with the conditions that policy initiatives operate within a logic of technological neutrality; intervene with horizontal and not vertical or sectoral actions; and also act on enabling factors. All the effective measures have been strengthened and addressed according to this 4.0 logic, and new ones have been envisaged to fully respond to the emerging needs related to the NPR. See https://www.mise.gov.it/images/stories/documenti/impresa_40_risultati_2017_azioni%202018_rev_eng.pdf 
In an effort to increase the dialogue between industry and science and technology, Italy has created the Technology Clusters, and the Industrial PhD programmes.

Since 2017, France, Germany and Italy have initiated trilateral cooperation to promote the digitisation of the manufacturing sector and to support the European Union's efforts in this area. The cooperation brings together the implementing bodies of the national strategies for Industry 4.0 in the three countries: Plattform Industrie 4.0 for Germany, Alliance Industrie du Futur for France, and the Piano Impresa 4.0 for Italy, which signed a joint roadmap in Turin in June 2017.

Within the G7 science initiative, Italy has, since 2018, co-chaired with Canada a Working Group on “Financing Science For Inclusive Growth”. The group aims to share expertise, exchange best practices and develop synergies on effective financial instruments and knowledge-transfer policies among the G7 economies, with a specific focus on their ability to improve and underline the crucial value of science and research for the prosperity of society.","Italy needs excellent, enthusiastic and well-rewarded human resources for research. This concept has been stated on different occasions by the Ministry of Education, University and Research, and endorsed by the “Comitato Interministeriale per gli Affari Europei” (CIAE: Interministerial Committee for European Affairs). 
The debate results in policy initiatives aimed at favoring brain attractiveness in Italy and their implementation,   such as: 
?	The Framework for Attraction and Reinforcement of Italian Science Excellence;   
?	The Extraordinary recruitment plan for researchers; 
?	The Doctoral training schemes; and the National Code of Equal Opportunities.   
?	The Legislative decree of simplification of research institutes, aiming to simplify the activities of public research bodies and to better define the researcher professional figure
?	The National Code of equal opportunities is to promote equal opportunities between women and men in all areas of society.","As an integral part of our country’s foreign policy, the Italian development cooperation’s approach is based on two priorities: first, the need to ensure the protection of life and human dignity to all the planet’s inhabitants; and second, a vision of cooperation as a method by which to install, improve and strengthen relations among various countries and various communities. This peer-to-peer exchange, in addition to increasing the mutual understanding necessary for comprehending the real needs of the recipients of interventions, fosters relations aimed at economic and, most importantly, at social and human growth that is respectful of environment and cultural variety and capable of protecting common assets such as water, food and energy, so as to ensure the greater prosperity of populations and peace among people.
Major attention has been given to neighborhood policy, within the Mediterranean area and towards the non-EU Eastern Europe, as scenarios where the diplomacy of science is considered to be functional to national priorities and valuable to help constructing a long-term regional cohesion. 

This approach complementary to the international dialogue dedicated to global challenges (SDGs) and to specific ones that occur within countries geographically far from Italy yet similar in societal issues. The ageing population that is determining a societal switch in many industrialized countries including Italy and Japan is an example. 

Within Italy, the debate aimed in raising public awareness of the value of R&I and the impact on society should materialize in divulging initiatives aimed in opening a continuous two-way communication channel between the citizenry and the R&I community.",
Japan,"To achieve sustainable development in Japan, which faces limited resources and a declining birthrate and aging population, horizontal and comprehensive STI cooperation among the public sector, private sector and other stakeholders is necessary.

To date, Japan has formulated a strategy every year in line with the Fifth Science and Technology Basic Plan (FY 2016-2020) and has defined priorities for further promotion of the Basic Plan. In 2018, the government formulated an “Integrated innovation strategy” with the aim of establishing the “Most Innovation-friendly Country in the world” by integrating the measures of the Cabinet Office and each Ministry. In 2019, the government revised the “Integrated Innovation Strategy 2019” based on the remarkable progress and changes in science, technology and innovation (STI) both at home and abroad. This policy is an important measure in that the government aims to promote innovation policies, from basic research to social implementation, across ministries and agencies.

As a “control tower” of these cross-ministerial policies, the Council for Science, Technology and Innovation (CSTI), established within the Cabinet Office, is composed of experts from academia and industry and chaired by the Prime Minister. CSTI is responsible for planning, guiding, and coordinating comprehensive science and technology policies in Japan.

Furthermore, based on the integrated innovation strategy, the government established the “Integrated Innovation Strategy Promotion Council” in 2018. This Council was composed of the CSTI and the “control towers” of other fields (e.g. information and communications, intellectual property, health and medical care, space, and ocean), in order to further strengthen cross-sectoral coordination across multiple policy areas closely related to innovation.","As for the present state of research capabilities, as measured by the number and quality of academic publications, the government recognises Japan’s relative decline compared to other countries. Basic research capabilities are the source of scientific and technological innovation, and the strength of basic research capabilities has a significant impact on international competitiveness. It is necessary to drastically strengthen Japan’s research capabilities with a view to the future, through the triple reform of human resources, research funding, and the research environment. At the same time, the government recognizes that Japan alone has limited resources, such as human resources and funding for research. Japan needs to strengthen research capabilities while actively cooperating with the rest of the world.

Basic research capabilities are potentially high and are expected to contribute to the creation of seeds that will lead to disruptive innovation. To promote this, it is important for the public and private sectors to cooperate to find promising seeds and to foster young researchers who will tackle them. This cooperation should go beyond conventional university-industry collaboration. While private investment in universities and national research institutes in Japan is on the rise, it has not yet reached a full-fledged level. Further efforts are needed to expand the scope of such investment.

In light of the declining birthrate and ageing population, Japan is facing a serious labor shortage, forcing it to rely on foreign workers in some fields. In the future, it will be necessary not only to improve productivity by making full use of AI and robots and drastically activating start-ups, but also to strengthen the quality of “human resources”, which is Japan’s greatest asset, to meet the needs of the times. The government considers it an urgent task to build a system in which all people participate in society based on the concept of a human-centered society.","The number of R&D-driven startups is increasing and expanding globally. In Japan as well, it is necessary to develop an environment in which the potential of human resources with an entrepreneurial spirit can be maximized, and to promote economic and social structural reform in an integrated manner through innovation in government projects and systems, including public procurement.

To achieve this, it is necessary to thoroughly strengthen the start-up environment by involving cities, universities, and other institutions, in educating world-class entrepreneurs and in drastically strengthening the accelerator function. For example, policies focusing on young start-ups are being promoted to strengthen the start-up ecosystems centred on universities and to promote entrepreneurial education. In addition, while promoting open innovation with large companies, the government will discover promising start-ups in rural areas and those that aim to capture overseas markets from the very beginning (Born Global). There is also need to review government procurement practices to encourage the development and introduction of advanced technologies and investment in the private sector.","The policy challenge is to strengthen industry-academia collaboration where the top management and headquarters of firms are actively involved. Recently, large-scale joint research, led by the top management of companies, and joint research courses in which research teams at companies set up laboratories in universities, have been conducted. It is necessary to continue to strengthen these efforts. In addition, since the National Research and Development Agency has a large number of one-of-a-kind research facilities, it is necessary to enhance the function of these facilities as a hub for innovation among industry, academia, and the government while sharing them with external organizations.","It is important to establish a system in which young researchers can play an active role in a variety of fields, including academia and companies, and that research is an attractive occupation. It is necessary to clarify the path for acquiring tenure posts in academia, with a non-tenure outcome the result of a fair performance evaluation after going through a certain competitive environment early on in careers.
In addition, in the context of falling numbers of doctoral students, the government is pursuing the following three objectives:
-	To make doctoral programmes more attractive by enhancing economic support. 
-	To develop doctoral human resources with advanced specialised knowledge, scientific thinking and methods, and problem-solving abilities in graduate school education. 
-	To create an environment in which young, well-trained researchers can lead challenging and creative research as early and independent principal investigators.
Furthermore, it is necessary for society as a whole to create an environment in which young researchers can foresee a stable career path in the future. Doctoral researchers should be able to play an active role in a diverse range of fields, and a diverse environment should emerge in which female researchers can play an active role.","Science, technology and innovation (STI) are key to solving global problems such as environmental, energy and infectious diseases. Based on this recognition, the promotion of STI for the SDGs will be positioned in the immediate action plan of STI policy and will be tackled by the entire government. The government recognises several challenges to this approach: for example, striking an effective combination of creating innovative technology seeds while promoting the upstream R&D that underpins their emergence; facilitating the creation of new ideas with a variety of experts coming from across different sectors; and fostering human resources who can connect various sectors. To facilitate multi-stakeholder engagement and international partnership for promoting STI for the SDGs, “Guiding Principles for the Development of STI for SDGs Roadmaps” were endorsed at the G20 Osaka Summit.",
