China,"Highly ranked issues in the Governance agenda include improving the allocation mode of science and technology resources, making full use of various economic resources, and improving the efficiency of science and technology inputs and outputs. 

Since 2014, the Chinese government has successively introduced several programmes related to the reform of the S&T system, which have been welcomed by the majority of scientific and technological workers. These programmes include ""the plan to deepen the management reform of the central financial science and technology plan (special projects, funds, etc.)"", the ""implementation plan to deepen the reform of the science and technology system"", the ""several opinions on increasing knowledge value-oriented distribution policy"", and the ""guiding opinions on the promotion of classified personnel evaluation mechanism reform"". In March 2018, the State Council integrated the responsibilities of the Ministry of Science and Technology and the State Administration of Foreign Experts Affairs, and re-established the Ministry of Science and Technology as a component of the State Council.","A key priority in China is the construction of science and technology innovation centres and national laboratories to strengthen national strategic scientific and technological strengths and continuously improve the national innovation system. Other priorities include strengthening the construction of independent innovation teams, improve the integration of scientific research resources, improve the collaborative innovation mechanism with universities, research institutes, enterprises, and the government, maximising the advantages of all aspects, and form an overall joint force to promote scientific and technological innovation.
The governance system needs to explore the establishment of an efficient and coordinated innovation system, accelerate the pace of scientific and technological system reform, and foster a good innovation pattern combining production, education, and research, integrating upstream, midstream, and downstream, and coordinating large and small enterprises. The system should also integrate national innovation resources, establish a new operating mechanism of goal-oriented, performance management, collaborative research, and open sharing, and build breakthrough-type, lead-based, and platform-type national laboratories. These laboratories should work with other types of research institutions, universities, enterprise R&D institutions, in order to form a new pattern of collaborative innovation with complementary functions and healthy interaction.

Relevant departments have recently formulated and promulgated documents aimed at expanding scientific research-related autonomy of universities and research institutes, to strengthen and optimise the layout of governmental research institutes and to increase stable support for basic research institutes. Research institutes have also formulated institutional charters to ensure their independent management and operation.
A key challenge is the tendency towards short-term research, which makes it difficult to produce real innovations. The Chinese government aims to address this challenge by revising various evaluation mechanisms. Activities include further advancing the reform of science and technology evaluation, implementing the reform and deployment of project evaluation and organisation evaluation, and accelerating the establishment of a classification and evaluation system oriented to the quality, contribution, and performance of scientific and technological innovation. These reforms should break the tendency of ""only papers, only professional titles, only academic qualifications, and only awards"", adhering to the combination of evaluation and use, and strengthen the dominant position of talent evaluation by employers.

Besides reforming evaluation mechanisms, scientific research integrity mechanisms should be improved. Activities include the construction of a research integrity information system covering the whole country and increasing the amount of investigation and punishment of violations and research misconduct. 

To improve the efficiency of scientific and technological resources in the public research system, China should adhere to the policy of “innovating mechanisms, revitalizing existing stocks, integrating and perfecting, and opening and sharing.” The country needs to improve the policy and institutional environment, strengthening the working mechanism and management system, building linked with local and regional departments, and promoting open sharing pilots in key regions and departments. Furthermore, an open sharing operation mechanism should be explored, while also strengthening supervision and evaluation and information disclosure.

The construction of policies and regulations has been continuously strengthened to optimise the open and sharing institutional environment for scientific and technological resources. The Chinese government seeks to promote the open sharing of large-scale scientific instruments and facilities composing the national S&T infrastructure, to serve STI actors, the economy and society as a whole. In 2017, related departments have introduced the ""Measures for the Management of Scientific Data"" to strengthen the standardised management of scientific data and promote a shared utilisation system.","In 2018, the Chinese government launched a pilot policy to promote angel investment and venture capital investment. It introduced various tax measures, such as improving the fixed asset accelerated depreciation policy, increasing the pre-tax deduction limit for general corporate employee education funds from 2.5% to 8%, extending the period for carrying forward corporate losses and improving the research expense deduction policy. The government allowed enterprises to entrust overseas research and development expenses to benefit from the pre-tax deduction policy. It increased the deduction rate from 50% to 75%, further motivating enterprises to increase investment in research and development, and supporting technological innovation.

For the first time in 2017, the government issued a technology-based SME standard at the national level, which increased the deduction rate for technology-based SMEs from 50% to 75%. A total of 84 000 technology-based SMEs nationwide enjoy preferential policies for R&D expenses plus deductions, accounting for 51.9% of enterprises enjoying preferential policies for R&D expenses plus deductions, and a reduction of 37.5 billion yuan in corporate income tax. At the same time, the government has completed the construction of the information service platform for technology-based SMEs and officially launched the independent evaluation service for technology-based SMEs.

Another area of significant activity concerns improving the intellectual property (IP) service system to form stable innovation expectation, and to effectively protect the initiative spirit of the participants of innovation. This includes reinforcing enforcement and introducing a punitive compensation system to fundamentally solve the outstanding issues that restrict IP protection, such as inconsistent judgment standards, geographical protection and complex litigation procedures. Such measures are expected to improve the incentive mechanism to encourage innovation from the perspective of the system and the direction of public opinion, establish a fair competition atmosphere, create a good environment for innovation, and respect those who dare to innovate. A stronger IP service system will accelerate the establishment of an academic integrity system and conduct zero tolerance for academic misconduct. It will also stimulate the entrepreneurial spirit, mobilize the enthusiasm for entrepreneurship and innovation in the whole society, promoting innovation and development.","In view of problems in the knowledge transfer and sharing system, it is necessary to implement and improve the policies for transforming scientific and technological achievements as soon as possible so that scientific and technological achievements can be allocated according to economic needs. The following measures are required:

1)	Break down regional barriers, reduce administrative intervention, and form a nationally unified, internally and externally integrated transfer and transformation market, so that scientific and technological achievements can flow freely in the market.

2)	Promote the reform of mixed ownership of scientific and technological achievements, promoting the joint ownership of property rights of scientific and technological achievements with those individuals or teams responsible, through agreed methods.

3)	Strengthen the specialisation of labour around the value chain of knowledge flows, fostering a group of specialised knowledge-operation institutions, and promoting the deep integration of technology and capital, and technology and industry. Also improve over-the-counter trading channels such as personnel mobility, education and training, in order to promote the transfer of tacit knowledge.

4)	Beyond state-owned asset preservation and appreciation, conduct classified management assessment based on the properties of intangible assets, simplify the existing management process of scientific and technological intangible assets and strengthen the implementation and connection of policies for the transfer of scientific and technological achievements, such as technology shares and personnel incentives.
In 2018, the National Technology Transfer Demonstration Agency continued to explore new mechanisms and new models of technology transfer services based on market demand. The government provides enterprises with technology, talents, and financial services through new organisations such as the Industrial Technology Research Institute and the Industrial Alliance. With the continuous deepening of technology transfer services, the demonstration institutions have put more emphasis on common technology research and development and achievement transformation, accelerating the industrialisation process of technological achievements. They also put more emphasis on supporting market-oriented mechanisms, full-chain services, capitalisation approaches, network support, and internationalisation.","Another set of priorities include improving the mode of talent training. Talent policies need to be improved and education needs to be further reformed to better cultivate young people's awareness and ability to innovate. It is also necessary to mobilise talents and establish more flexible talent management mechanisms, to deepen education reform, to promote quality education and innovative education methods, and to improving the quality of talent training. The aim is to form an educating environment conducive to the growth of innovative talents. 
The education systems needs to stimulate the creative energy of talents, and vigorously train and bring up a large number of strategic scientific and technological talents, scientific and technological leaders, young scientific and technological talents and high-level innovation teams with global vision and international standards. Another priority is taking the ""double first-class"" construction of first-class universities and first-class disciplines as an important content of priority education development. At the same time, it is necessary to create innovation environments that respect personality and tolerate failure.","In past decades, STI policies for social development has been relatively neglected, compared with those for economic growth. More recently, many projects have been initiated or started to redress this imbalance, including the S&T Benefiting the People project in 2012; and the National Innovation Demonstration Zone for the 2030 Sustainable Development Agenda in 2017.",
Colombia,"Colombia is currently having important debates around the governance of its national framework for Science, Technology and Innovation (STI) policy. At the centrepiece is the creation of the STI Ministry, its role on designing and formulating STI policies and improving institutional governance. The Ministry is being created within the transformation of Colciencias, Colombia’s main STI funding agency. Another key discussion focuses on the role of a National Council of STI, as an instance of consultation and definition of policies (currently the Advisory Council for STI leads this role). The country is carrying out an Expert Committee known as the ""Misión de Sabios"", composed of 47 experts in the public and private sector working on research and development activities. There are eight thematic focuses to propose the roadmap for STI and Education for the next 25 years.

Regarding governance, the current articulation between the National STI policy framework and the Competitiveness and Innovation policy framework has been discussed. This includes instances of coordination and complementarity, as well as the articulation of Departmental (regional governments) science policies and plans with available technology and innovation capacities. Another key discussion is the role of the Departmental Councils of STI in identifying challenges, setting priorities and the allocation of resources following such priorities.","The current national strategy for Science, Technology and Innovation (STI) has a territorial approach, arising from the “STI Pact” from the 2018-2022 National Development Plan. This document proposes an increase in research and development investment of 1.5% of GDP by 2022 (doubling the investment). This implies seeking the sustainability of STI resources, both from current sources such as that of the General Royalty System’s (SGR) STI Fund (SGR-FCTeI), as well as the search for new sources.

There is currently a proposal for reforming the SGR-FCTeI. Through this fund, the government has established the Bicentennial Doctoral Grants and allocated resources for the institutional strengthening of higher education institutions. These new instruments have supported public research institutes to generate knowledge and technologies of public interest. A need has been identified to review how these programs have performed and redesign them accordingly.","The main discussions centre around: (i) innovation and support for productivity in the manufacturing and service sectors; (ii) promoting the bio-economy, the digital transformation and industries 4.0; and, (iii) business innovation systems for small and medium enterprises.

In addition, ongoing discussions are taking place around revising the design of funding programs and instruments to better address companies’ needs, the expansion of access to tax benefits for small and medium-sized enterprises and the management and the creation of capital funds. Key opportunities have been identified for seed funding and risk guarantees, particularly for the spin-off and technology-based entrepreneurship policy in specific sectors, such as the creative economy (Economía Naranja), particularly within the agricultural sector.","The current debates are oriented to the design and implementation of policy strategies boosting linkages between companies, universities and the public sector. This includes the design of financing programs and instruments and the consolidation of technology transfer offices and technologies for the productive and social sector. Other policy areas of attention are the design of international technology transfer programs for small and medium-sized enterprises and the commercialisation of intellectual property research results and products from university-business negotiation processes.","The main discussion centres on the update of the high-level education policy, with particular attention to PhD and research-oriented master’s programs. A specific area being explored is the creation of programs helping the insertion of PhDs in companies and public and territorial entities. Tax benefits are being contemplated for companies that link personnel with doctorates and research masters.

Additionally, the role of emerging technologies and their influence on education and training in permanent learning systems has been debated. In particular, questioning to what extent the country should continue financing the training of doctors in all areas of knowledge or if certain ones should start being prioritized. Likewise, another discussion is exploring the ability for the Colombian national STI system to welcome human capital graduating at the doctoral level.","Key areas of debate are the importance of the formulation of mission-oriented policies, programs facing societal challenges and the implementation of experimental programs. Other areas of policy being discussed include: 
(i)	the incorporation of new technologies and emerging technologies; 
(ii)	to improve the production and income of farmers in the agricultural sector; 
(iii)	the implementation of open and competitive calls for research and development, which define program areas, challenges and program financing related to the Sustainable Development Goals; and, 
(iv)	how to generate a more inclusive and sustainable science system.",
Costa Rica,"There are two main ongoing policy debates: 

1)	The creation of a new innovation agency to improve Costa Rica's STI governance that efficiently shapes policy design, implementation, delivery and evaluation. At the beginning of October 2019 the country engaged in a legislative process to reform its National Council for Scientific and Technological Research (CONICIT) into a Research and Innovation Agency. If the bill is approved, the new Agency will be responsible for the implementation of different national instruments and programs that aim to boost research, innovation, human capital and start-ups. 

2)	The country has undertaken a debate about digital technologies in the context of the so-called fourth industrial revolution (4IR). To move forward in this regard, the Ministry of Science, Technology and Telecommunications (MICITT) launched in October 2018 the Digital Transformation Strategy: The Bicentennial of Costa Rica 4.0. This strategy contains the country’s vision and proposes the lines of actions needed to drive Costa Rican society towards the new digital economy and to address country challenges, by making a better use of digital technologies in the government, the private sector and society as a whole. 4IR requires new approaches in practically all STI policies. Chambers of commerce, ministries and civil society recently started debating the governance of this transformation.","There is an ongoing debate about the Higher Education Fund (Fondo Especial para la Educación Superior Pública, FEES), which finances public universities. Costa Rican fiscal problems puts pressure for the reduction in costs and accountability for the allocation of these universities resources, which are mainly invested in day-to-day expenses and salaries for teaching. These expenses are defined by law, thus the reduction in FEES would primarily affect the allocation of funds for R&D. 

Another debate is about appropriate incentives for researchers that support industry needs. Traditionally, incentives in public universities have focalised in academic outputs (e.g. publications). Changing them requires important modifications in internal regulations of universities, which implies a lengthy process of discussion and analysis.","There are two main ongoing policy debates: 

1)	Financing start-ups and SMEs in biotechnology, nanotechnology and convergent technologies that requires long-term support while current instruments allow allocations for only two or three years. As a possible solution, ongoing discussions are exploring linking or concatenating different existing funds. This could support the long-term funding requirement for this kind of projects.

2)	The process in which entrepreneurs, SMEs and other actors apply for public funds. In particular, how to simplify the process despite a complicated regulatory framework which is difficult to improve. For example, several regulations consider only SMEs, excluding other kinds of actors in agriculture or the creative economy.","The main ongoing debate has focused on how to improve the link between the academic sector (universities and other public and private research centres) and the private sector. Factors associated with the regulatory framework and institutional regulations of academia have hindered such links. Although in the past years all public universities had created technology transfer offices, the regulations established in these offices are not necessarily known by the academic community and even less so by industry actors. 

The Ministry of Science, Technology and Telecommunications (MICITT) is currently carrying out an analysis to allow characterising the barriers to technology transfer and commercialization in Costa Rica. This, with a view to implement pilot projects aiming to find alternatives that help resolve these obstacles. In parallel, the Export Promotion Agency of Costa Rica (PROCOMER) is conducting a study to map the available technological services and research infrastructure in the field of life sciences and medical devices.","One of the main discussions around this topic focuses on the reskilling of our human talent to new areas of knowledge, which are being developed worldwide or that will require life-long learning processes. The discussion emphasizes the role of the Costa Rica’s National Institute for Learning (INA) and its capacities to respond to the requirements of companies to these trends. In particular, the debate centres on the sorts of training that should be provided. Promoted skills should provide people with low academic qualification opportunities to add value and successfully address emerging needs of companies. Universities also need to align their academic programs with these needs to meet the demand of human resources for the knowledge economy. 
The main government initiatives in 2018-2019 are: 
-	Loan from the Inter-American Development Bank (IADB) for Innovation and Human Capital Development: specialised reskilling training for innovations projects in areas such as cybersecurity, IoT, AI, big data, and analytics.
-	The dual vocational education and training bill: on September 2019, the Costa Rican Parliament approved a dual vocational education and training bill. The legal framework will impact enterprises, students and workers who require learning new skills and abilities in a practical and agile way.","Since the publication in 2017 of the “Knowledge based Society and Economy National Policy” by the Ministry of Science, Technology and Telecommunications (MICITT), R&D&I policies have had an alignment with social development goals (SDGs), focusing in Grand Challenges. The recent “Digital Transformation National Strategy and the Bioeconomy National Strategy” to be published early in 2020 will also pursue the articulation of national and international efforts to attend global challenges by intensifying cooperation. In this area, another notable strategy published in 2019 is the “National Plan of Decarbonization”. 

The “Bioeconomy National Strategy” is a joint effort between four Ministries, i.e. led by MICITT with the participation of the Ministry of Environment and Energy, the Ministry of Agriculture and Livestocks and the Ministry of Economy, Industry and Trade. This strategy recognizes that the bioeconomy provides a basis for productive transformation in Costa Rica, through the application of knowledge for:
-	Increasing value added in the agricultural, aquaculture and fishing, forestry and agro-industrial sectors;
-	Processing waste and residues from the agricultural, aquaculture and fishing, forestry and agro-industrial sectors;
-	Diversifying production and encouraging the development of new value chains; and,
-	Sophisticating national production, with a sustainable use of resources offered by the Costa Rican biodiversity and the application of knowledge in the field of biological sciences.

The strategy establishes that the bioeconomy offers Costa Rica the opportunity to make a big leap towards sustainability, reconciling objectives of productive development and environmental protection, and the sustainable use of our biological wealth.",
