Country,Governance,Public research system,Innovation in firms and innovative entrepreneurship,Science-industry knowledge transfer and sharing,Human resources for research and innovation,Research and innovation for society,Emerging trends in STI policy
Country,"Briefly, what are the main ongoing issues of debate around how national STI policy is governed in your country?","Briefly, what are the main ongoing policy debates around government support for your country's public research system?","Briefly, what are the main ongoing policy debates around government support to business innovation and innovative entrepreneurship?","Briefly, what are the main ongoing policy debates around national policy for science-industry knowledge transfer and sharing?","Briefly, what are the main ongoing policy debates around government support for human resources for research and innovation?","Briefly, what are the current main policy debates around how national policy for research and innovation can help address societal challenges? If applicable, please elaborate on how the Sustainable Development Goals (SDGs) are being incorporated into STI ",
Argentina,"The governance of Science, Technology and Innovation (STI) policy in Argentina is grounded in historical processes of emergence and institutionalization of STI developments in a federal country, mostly funded by the public sector. 

Pillar institutions were created in the late 50s, including the National Council on Science and Technology (CONICET) and its Scientific Technological Centers (CCTs) that span all over the country, the National Commission of Atomic Energy (CNEA), the National Institute for Agricultural Technology (INTA) and the National Institute for Industrial Technology (INTI). Also at this time, national universities set up full time positions for scholars devoted essentially to basic research. 

In 1958 and under the umbrella of the Ministry of Education, the Secretary of Science and Technology (SICYT, Secretaría de Innovación, Ciencia y Tecnología) was created as the main governmental entity devoted to promote national policies in S&T. Public bodies in other Ministries were established under a mission-oriented approach to encourage applied research and technology development in Health, Mining, Agriculture, Energy, Foreign Affairs and Defense. 

In 1996, the National Agency for the Promotion of Science and Technology (ANPCYT) emerged as a decentralized body with two funding instruments: the Fund for Scientific and Technological Research (FONCyT) and the Argentine Technological Fund (FONTAR) -a decade later, the Fund for the Promotion of Software Industry (FONSOFT) and the Sectorial Argentine Fund (FONARSEC) were also incorporated. 

In 2007, the Ministry of Science, Technology and Productive Innovation (MINCYT, former SICYT) was created. It was conceived as the main responsible political body for the governance of the STI national system, which comprises not only political advisory bodies, legislative commissions, universities, and organisms, at national, provincial and municipal level, but also any other entity that aims to carry out essential activities linked to science, technological development, innovation, and capacity building of human resources. 

As stated by its foundational Act (Law 25.467), one of MINCYT´s main duties is to promote and guide R&D in strategic areas by establishing a National STI Plan. To encourage synergies at national and provincial levels in priority fields set by the STI plan, three key structures were established under the MINCYT: 
1) 	the Scientific Technological Cabinet (GACTEC), chaired by the head of the Cabinet of Ministers, which constitutes an inter-ministerial and interdisciplinary setting that also channels interaction with both Congress chambers, articulating consultations, exchanging information, discussing resource allocation; 
2) 	the Inter-institutional Council on Science and Technology (CICYT), coordinated by the Secretary of Scientific Technological Articulation (SACT), in which all relevant actors of the STI national system are being represented; and 
3) 	the Federal Council on Science and Technology (COFECYT), aims to promote regional policies with special focus on less-favoured provinces for a harmonious development of the country. Links with private sector are encouraged by ANPCYT´s funding instruments (see above), as well as CONICET´s Network of Technological Transfer Offices, and universities´ Units of Technological Transfer (UVTs) devoted to provide technical assistance on project management and the commercialisation of research.","The following topics framed most recent debates on national R&D policies:

-	The priority setting mechanisms of the current National STI Plan “Argentina Innovadora 2020” to enrich diagnosis and contents of the “Argentina Innovadora 2030” follow-up proposal, as well as prioritisation for sub-national STI policies, regional and sectorial programmes and inter-ministerial initiatives.

-	The amount and distribution of federal budget for STI development, with particular focus on strengthening capabilities of less-favoured regions, and special concern on satisfying specific social demands to insure that public funded research contributes to a harmonious wellbeing. 

-	The profile, performance and federal distribution of human resources of the scientific community (researchers, technologists, innovators, entrepreneurs, science administrators) and how these meet the needs and interests of CONICET, universities and R&D centers where these actors perform.

-	Improving institutional evaluations and resources and tools for the accountability of publicly funded projects. 

-	Boosting open science and transparency by facilitating access to (i) primary research data; (ii) open access publications; (iii) statistical visualizations; (iv) funded projects; (v) researchers curricula; and, (vi) online applications for scientists, entrepreneurs, technicians, journalists and governmental actors.

-	Develop new instruments to support business involvement in STI novel supplies, by connecting researchers, technologists, professionals, organizations and companies with venture capital interested in supporting and financing scientific projects, innovations and novel products.","The overall context for the Argentinian SMEs and entrepreneurs and their international expansion has been favoured by efforts done by the current government to bring macroeconomic stability, decrease inflation -towards reaching the one digit goal in 2019- and to institutionalize frameworks to guarantee a sustainable growth.. 

Legal instruments and financial tools have recently received particular attention, such as seed funds, loans, tax exemptions for innovation, public-private co-investment programs, crowdfunding platforms, and venture capital for technological and scientific-based accelerators. Though recently created, the Trust Fund for the Development of Entrepreneur Capital (FONDCE), the Simplified Stock Company (SAS) and the Collective Financing System are also expected to encourage the expansion of the entrepreneurial capital industry.","As in other countries, there are two main concerns that structure current debates: 
1)	the increased speed of transition to a globalized and highly competitive knowledge-based economy, which also means shorter product cycles and hence shorter time horizons for private sector to invest in R&D; and 
2)	budgetary constraints faced by governments and their impact on the funding of university research, in a context in which research and development costs are higher. 

To addresss these challenges MINCYT developed Innovation Argentina (http://www.innovacionargentina.gob.ar/), a web platform that that seeks to enhance synergies between relevant actors of the National System of Science, Technology and Innovation and the private sector, by exchanging ideas, information and available resources in relation to their capabilities and needs of technological innovation. This Project was strategically designed in four main courses of action: 
1)	the Platform for Demands and Technological Transfer (PDTT), a network of institutions from the academic, scientific-technological, governmental and business sector, which carry out a survey of innovation demands and publish those demands online to increase visibility and generate a prompt response; 
2)	the Support to the Productive Sector (ASEP), that provides guidance and assistance on available financing tools for entrepreneurship, applied research and the addition of value to the national production; 
3)	the Strengthening Program for Technology Transfer Offices (OVTT), aiming to back these interface units that facilitate the interaction between the generation of knowledge and its application, providing guidance on project management, financing tools and intellectual property rights; 
4)	the Support Program for the Study of Technological Demands (PAR), which seeks to develop the work of human resources highly specialized in technology transfer, particularly their efforts to generate future projects that will contribute to meeting demands disclosed by the PDTT.","In Argentina, the growth of research is uneven in the different areas of knowledge and geographical regions. Moreover, fundamental research has traditionally not been oriented around specific priorities, though there have been attempts in the past to change this tradition. Nowadays, the main debates around the STI human resources system and relevant policies refer to the balance between free vs problem-oriented research, to the improvement of mechanisms for technology transfer and to the evaluation of the performance of researchers. All of these show that it is necessary to encourage and reinforce a virtuous link between the production of knowledge and its applications.
In the past fifteen years, some public scientific research institutions have had important staff increases. However, this has not been accomplished within the framework of medium- and long-term perspectives for the STI system and the development of some disciplines has been prioritised. Particularly, it is important to point out concern in the case of some public technological research institutions or some universities where there are shortages of researchers or ageing staff and replacement after retirement has not been properly foreseen.","Social Innovation is essential in generating positive proposals for progress and cohesion that face the greater economic, political and cultural challenges brought by the current socioeconomic context. 
Promoting Social Innovation requires revising some paradigms in the design of public policies, as well as identifying and articulating participation channels. Through these, citizens can take an active role in generating new perspectives, methods and tools that provide solutions together with public and private institutions, entrepreneurs and creators of business networks and non-governmental organisations. 
Social Innovation is, therefore, at the centre of the debate on renewing spaces for socio-economic development. The search for public consensus in the design of the measures to adopt is of particular importance for systematising the strengths and weaknesses of the situation.",
Australia,"The debate around national science, technology and innovation (STI) policy governance has focused on the need for increasingly strategic and co-ordinated approaches to ensure that effort is focused on achieving national priorities. In Australia, government science and research activities follow a hybrid model, with responsibilities distributed across government and located where most relevant. Hence, maintaining strategic direction requires good co-ordination.

The Australian Government will continue to drive STI policy systematically and strategically, informed by the latest evidence and in areas of national priority. Aligning Commonwealth, state and territory initiatives is a significant issue in this regard. Under the aegis of the Council of Australian Government, the Industry and Skills Council has agreed on a set of common objectives to guide a nationally consistent approach. Initiatives such as the National Innovation and Science Agenda; the National Science and Technology Council; Innovation and Science Australia; the National Science Statement; and the National Science and Research Priorities have been developed or implemented to provide strategic guidance on STI policy governance.","Australia’s public research sector is known for its capacity to attract excellent international researchers and students to our universities, bringing spill over effects to the national economy. 

Australia has a high quality research system and performs strongly against most measures of achievement. Despite accounting for only 0.3 per cent of the world's population, we produce more than 3 per cent of research publications (2015) and around 12.6% per cent of the top 10% of highly cited publications (2015). However, collaboration between small and medium enterprises (SMEs) and researchers is low by OECD standards, with 2.7 per cent of SMEs collaborating with higher education or public research institutions in 2012-14.

There is interest in investigating the ways businesses and higher education sectors can better work together. Australia continues to be focused on approaches to better support research collaboration, the translation of research into social and economic benefits, as well as supporting high-quality basic research, driving efforts to improve research engagement and impact. Another area of focus is the need for Australia’s research-training system to better equip students with transferable skills, thereby ensuring their ability to apply their knowledge in the workforce.

Australia is investing in national research infrastructures and open data platforms to coordinate and integrate research domains across the country. The 2018 Research Infrastructure Investment Plan, based on an earlier National Research Infrastructure Roadmap, has informed planning and investment into platforms necessary for collaborative research in a variety of fields including high performance computing, health sciences, and earth and environmental systems. Data-based research infrastructure built through this initiative seek to meet a range of needs, such as coordination for state and national research efforts, as well as provide an interface for academia, private enterprise and international researchers. Ongoing scoping is being conducted into how to efficiently prioritise future research infrastructure investments as the sector continues to evolve digitally and thematically.","Public investment in the innovation system must provide economic and social dividends through increased job opportunities and economic growth. Spurring innovation is a major factor in improving productivity and an important policy objective for the Australian Government. It is particularly important in the current economic environment, characterised by fiscal constraints and low interest rates. Business innovation improves business performance, including internal competitiveness: the more novel and frequent the innovations, the greater their impact on business performance. 

A major focus of the debate on innovation policy has been how to allocate government resources most efficiently among targeted innovation initiatives. 

Another key issue pertains to how the Australian Government can best embed a culture of innovation in Australian business. This debate has focused on the following elements:
-	Ensuring greater collaboration between industry and the research sector (including discussions on realigning incentive structures for both sectors).
-	Enacting regulatory changes to counter a culture of risk aversion, while preserving incentives for investors.
-	Establishing mechanisms to enable businesses to access the skills they need to remain competitive.

Further policy debates around government support to business innovation and innovative entrepreneurship involve how best to encourage business investment in research and development activities and how government procurement can be used to support and incentivise innovation.","Over the past two years, the government has maintained a strong focus on the knowledge-transfer system and considerations on how to raise the level of business expenditure in research and development (BERD) are becoming increasingly prominent. 

The Australian Government supports knowledge transfer between the publicly funded research sector and business through a variety of programs. Some programs are large and have been in place for many years, e.g. the Cooperative Research Centres (CRC) Program, the Rural R&D Corporations, the Australian Research Council (ARC) Industrial Transformation Research Program, as well as activities undertaken by the Commonwealth Scientific and Industrial Research Organisation (CSIRIO). Other programs, such as the Innovation Connections element of the Entrepreneurs’ Programme, are small in comparison but proving to deliver valuable outcomes in bridging the gap between university researchers and small and medium businesses. Another key government policy is the Industry Growth Centres Initiative. A main objective of the Initiative is to improve engagement and linkages between research and industry, as well as within industry, to achieve stronger commercialisation outcomes in Australia’s key sectors. 

The most significant changes to government policy on research-industry linkages have pertained to universities. The Australian Government provides substantial support to universities through block-grant funding. In recent years, it has increased the degree to which it allocates this funding based on the income universities receive from industry. These changes in incentive structures have started delivering real results, with universities more conscious of their need to engage with industry participants to successfully translate their research.","Recent years have seen competing narratives concerning the oversupply of science, technology, engineering and mathematics (STEM) graduates on the one hand, and skill shortages in some STEM areas (particularly engineering and information technology) on the other. This debate is partly driven by the mismatch between the skills taught in tertiary education and the skills required by industry. While university enrolment in STEM fields has grown steadily over the past decade (with the natural and physical sciences registering the strongest growth), it has remained stable as a share of total enrolments. Some see the large numbers of science graduates working outside of research as evidence of oversupply. Others see it as evidence of the broad applicability of scientific training, particularly in innovative industries and firms.
There has been growing recognition of the needs to: (i) integrate STEM skills with non-STEM skills (e.g. in business and entrepreneurship, and more broadly, the humanities and social sciences); and, (ii) to develop more flexible pathways between academia and industry to support innovative activities.
Noting the need to transition to an increasingly knowledge-based economy, the Australian Government recognises the importance of a highly skilled, STEM literate workforce. To help facilitate this, the Australian Government has a suite of initiatives to increase opportunities for students to engage with STEM. For example, the government supports students to participate in the International Science and Mathematics Olympiads. 
In addition, the Australian Government is also taking steps to ensure the full potential of the workforce is realised. The government is seeking to address STEM gender equity issues by investing in initiatives to increase participation of women and girls in STEM including the Advancing Women in STEM Strategy and the expansion of the Science in Australia Gender Equity (SAGE) program.","The Australian Government is committed to promoting a prosperous, dynamic and fair Australia, featuring globally competitive businesses, well-paid jobs and high living standards. Innovation through research and development, and technology transfer and adoption are key to delivering these outcomes and are important drivers of productivity and economic growth, which in turn provides a means to improve social and environmental outcomes for all Australians. The government continues to investigate ways to improve Australia’s innovation system, to create an environment that fosters a culture of innovation among researchers, businesses and workers, and throughout the country’s communities, including in regional and rural areas. 

A key debate in innovation policy has focused on finding an appropriate balance between translational and applied research, and other activities (e.g. basic research) that do not present obvious applications, but generate new knowledge that may lead to positive spillovers. In recent years, the government’s targeted innovation policies have focused on further translating Australia’s research into commercial outcomes. However, the government continues to recognise the importance of basic research, as well as pursuing long-term strategic opportunities in both established and emerging industries.

Discussions have also highlighted that disruption caused by innovation may have adverse effects on certain individual and communities, e.g. by displacing existing jobs and challenging the viability of existing businesses. The debate around Australia’s innovation policy, therefore, has increasingly focused on leveraging innovation to help Australian workers and businesses respond to change (e.g. through education and training), in order to maintain or improve living standards for all Australians, including in the regions.

A broad and sustained support base is required to pursue ambitious initiatives and so is a willingness to embrace risk and weather some failures along the way in pursuit of societal and environmental goals. A further policy debate is how best to direct investment and achieve the scale and focus required to tackle national or global challenges. High-impact national projects such as “national missions”, can harness the power of a country’s science, technology and innovation (STI) and entrepreneurial talent towards addressing societal challenges. The potential to implement a missions-based approach to policy to address societal challenges is being considered by the Australian Government.",
