Romania,"Current debates focus on: (i) R&D intensity (GERD is currently accounting for 0.51 % GDP); and, (ii) shifting decision-making from the national to regional level (NUTS2). Each region has a Regional Development Agency (RDA) that elaborates a Regional Development Plan ensuring the technical management of funding. A proper regionalization process, however, remains uncertain in Romania. The topic has been intermittently on the top of the public policy agenda, but controversies regarding the appropriate depth and breadth of regionalization have determined the delay of any firm decision. To date, neither of the two types of regions (NUTS1 and NUTS2) have a legal status, and both exist primarily for the purpose of coordinating development projects.

Besides the region of Bucharest-Ilfov, the other seven completed in 2017 the design of Smart Specialization Strategies, responding to the European Commission’s requirement for regions within European Union Member States to receive funding from the European Regional Development Fund (ERDF). Romania’s regional strategies constitute inputs to the ongoing process of developing a national R&D and innovation strategy. To coordinate the regional and the national policies, in August 2019 a National Committee for Coordination of the Smart Specialisation Strategies was established. It includes members from various ministries such as the Ministry of Research and Innovation, the Ministry of Economy, the Ministry of National Education, the Ministry of Agriculture and the Ministry of Communications and the Information Society. 

At the end of 2019, the Ministry of Research and Innovation was merged with the Ministry of National Education to form the Ministry of Education and Research (MER). A share of around 90% of the total R&D budget is coordinated by MER. The remaining part is coordinated by the Romanian Academy while less than 1% is the responsibility of sectoral ministries. 

MER collaborates with two advisory bodies on RD&I: i/ the Advisory Board for RD&I, composed of scientific and business community representatives and supporting the promotion of applied research and innovation, and ii/ the National Council for Scientific Research composed of scientific community representatives and supporting the promotion of fundamental research and the development of human resources for research. Both RD&I advisory bodies have important responsibilities in assisting the MER to shape its policy and to design and evaluate the implementing instruments.","The RD&I system in Romania consists of 263 public R&D organisations (56 public universities, 46 national R&D institutes, 65 research institutes and centres of the Romanian Academy, and another 96 public research institutes and centres), and about 600 private companies declaring R&D. The network for technology transfer and innovation (ReNITT) has around 50 specific organizations (technology transfer centres, technology information centres, technology and business incubators). The number of R&D personnel in the public sector was approx. 31,500 in 2018. The percentage of researchers per 1000 civil employed persons was 2.02 (2017, https://data.oecd.org/rd/researchers.htm). General remarks are (i) the public system is too fragmented with respect to the available funding, and (ii) low administrative capacity. The financing agencies Executive Unit for Financing Higher Education, Research, Development and Innovation (UEFISCDI), Romanian Space Agency (ROSA) and Institute for Atomic Physics (IFA) are managing the implementation of the National RD&I Plan. 

The assessment of the implementation of RD&I programmes is carried out by independent entities. Ongoing discussions highlight that actual national policies have to tackle some challenges: (i) not enough agreement among short-term results, budget cycles, and long-term strategies, which should transcend the electoral cycle; (ii) the existence of too many strategies suffering from overlaps and discrepancies between design and implementation; (iii) significant degree of fragmentation of the public system, lack of coordination and communication; and (iv) insufficient and unpredictable financing, which means that not all the planned financing instruments come into force.","Debates primarily focus on regional-national smart specialization strategic visions, involving Romania’s eight regions and the relevant ministries. Discussions have focused mainly on finding sectors with strong potential for smart specialization potential. A preliminary list includes: creative industries, Information and Communication Technologies, bio-economy / biotechnologies, pharma, automotive, naval Industry, metallurgy, electronics). Another theme concerns the factors that hinder innovation, including (i) public funding for R&D and for innovation based on R&D, (ii) education and human resources (scientific and entrepreneurial), (iii) legal and fiscal framework, and (iv) collaboration for R&D and innovation and technology transfer. 

Structural deficiencies in markets have been identified with large gaps in competitiveness and technological readiness of local companies compared to the main EU competitors in most sectors, especially in agriculture. The lack of an adequate transport infrastructure affects the automotive sector. Stakeholders consider this the most serious handicap of the Romanian industry in terms of competitiveness on the European market. In addition to the transport infrastructure, another major bottleneck is the lack of a clear vision for the country’s economic development.","Debates have been provoked by the country profiles revealed by the European Innovation Scoreboard and the 2018 Progress Report for the European Research Area. 
Deeper insights have been identified in the OECD report on entrepreneurship and innovation (available at https://heinnovate.eu/sites/default/files/oecd_ec_supporting_entrepreneurship_and_innovation_in_higher_education_in_romania.pdf), in the Romanian Academy study ""Increasing the administrative capacity of the Ministry for Business, Trade and Entrepreneurship to implement the evidence-based public policy”, as well as in the annex „Analysis of factors that obstruct the diffusion of innovation, including digitization”. 
Under constraints of resource scarcity, opinions are divided regarding objective criteria to determine the appropriate share of budget allocation for experimental development against fundamental research. Pro arguments for the first rely on the expectations of quantifiable economic benefits, in line with the financing philosophy of a large part of European programmes, like Horizon Europe. A super deduction of 150% of RD expenses is in force for companies investing in applied research and experimental development (tax relief through a volume based RD tax allowance at an additional rate of 50%). This is not fully agreed by the research centres located in the Magurele area (e.g. Extreme Light Infrastructure) which consider fundamental research as a viable option. 
Another debate is on university research vs. national RD institutes: the latter do not behave as sources of knowledge / technology for the industrial sectors they serve.","A downward trend in student population started in the 2009-10 academic year. Causes included a decreasing number of high school graduates passing the baccalaureate exam and the reduction in years of study (i.e. the effects of the Bologna process implementation started showing after 2008-09). Other possible causes leading to this drastic decrease are the high early-leaving rate in the pre-university education system and the phenomenon of external migration, which affects the size of the cohort that can reach this educational level. Many programmes in private universities have closed down. While in the 2010-11 academic year there were +870 000 students enrolled in public and private higher education institutes (HEIs), the figures dropped to +530 000 students in 2016-17. Of the total number of students enrolled in higher education in this year, only 3.6% were in doctoral programmes and 0.6% in postgraduate programmes. 

In the last academic years, the distribution of students by specialisation shows higher weights in certain areas. In 2016-17, 23.7% of undergraduate students were enrolled in business, administration and law; 21.1% in engineering, processing and construction; and 16% in the health and social assistance group. The lowest numbers are recorded in the following fields: education sciences (3.1%), services (3.7%), and natural sciences, mathematics and statistics (4.1%). The last group is critical for R&D capacity and therefore for the development of technology- and knowledge-intensive sectors. 

To tackle the challenges, a tax exemption on salary incomes for the personnel involved in CD activities came into force since 2016. The exemption is granted for all persons included in the team of an RD&I project within the limits for personnel costs.","The Romanian Academy (RoA), as member of All European Academies, gives particular attention to open science initiatives such as Science Europe’s Plan S. The RoA considers that effective policies on open access to scientific information require a shared international approval. At a national and institutional level, policies on non-discriminatory, democratic and free access to scientific information should be implemented. Scientific communication can be achieved only by approving new models that remove barriers to information sharing.",
Russian Federation,"Current debates in STI policy are focused around national development goals stated in the Russian President's Decree No. 204 dated May 7, 2018 ""On the National Development Goals and Strategic Objectives of the Russian Federation in the Period until 2024"". Two national goals out of nine to be achieved by 2024 refer to ""acceleration of the technological development of the Russian Federation, an increase in the number of organizations implementing technological innovations, up to 50 percent of their total number"" and ""ensuring accelerated implementation of digital technologies in the economy and social sphere"". 

To achieve these national goals in STI and digitalization, the national project ""Science"" and the national programme ""Digital Economy"" have been adopted by the President's Council on Strategic Development and National Projects in 2018. The activities within these two programmes will be one of the major focuses in STI policy in the coming years.","The ongoing debates around the public research system primarily refer to the implementation of the national project ""Science"" and its new tools – establishment of world-class research and educational centers in the regions, update of research equipment, and launch of complex S&T programmes within the S&T priorities of the Russian Federation. The adoption of the new law ""On scientific, scientific and technological, and innovation activities in the Russian Federation"" is another important issue being discussed within the government, the parliament and the expert community.

Compared to the previous period of the 2010s, when the role of universities in research and innovation was particularly emphasized, now the Russian Academy of Sciences is trying to reestablish itself as a leading expert centre taking an active part in formulating and evaluating science policy, as well as in assessing basic research results nationwide.","The major national goal has been set within the President's Decree of 7 May 2018 No 204 to accelerate technology development of the Russian economy and to increase the share of enterprises engaged in technological innovation up to 50%. Key policy initiatives in this domain include the National Technology Initiative aimed at opening new innovative markets, the new National Project ""Labour Productivity and Employment Support"", which provides indirect support of organisational and technological innovations at industrial enterprises, and the National Programme ""Digital Economy"". The latter provides a number of new grants and subsidies to support innovative SMEs within the IT sector.

The President’s Decree has given new impetus to several ongoing activities. In particular, the Foundation for Assistance to Small Innovative Enterprises has scaled up support for projects aimed at commercializing scientific results, as well as for projects commissioned by an industrial partner. The Internet Initiatives Development Fund has stepped up its efforts to accelerate high-tech business and attract seed investment.","Ways to increase the effectiveness of academic-industry collaboration remains on the Russian STI policy agenda. One of the new government initiatives is the establishment of world-class scientific and educational centres in the regions. The centres are created in the form of consortia of R&D organisations, universities, and business enterprises, which are supported by regional authorities. Their main goals are to streamline technology transfer and increase sales of innovative and high-tech products.
Another policy direction concerns support to the digital transformation of Russian industrial enterprises, as well as development and transfer of general purpose technologies in the sectors of the national economy. Particular policy tools in the form of grants and low-interest loans are under development.","The development of human capital for science, technology and innovation has been one of the major focuses in the last years. It has been included in the S&T Strategy of Russia. Increasing the attractiveness of work in Russia for leading scientists and young promising researchers is one of the national goals approved by the President of the Russian Federation. A number of new research grants were introduced within the National Project ""Science"" to support research projects implemented by PhD students and young scientists, as well as to facilitate academic mobility within Russian regions. Another policy initiative aimed at improving management skills of Russian scientists concerns the establishment of centres for training of managers of research projects and research laboratories in the regions.

Other tools to promote the development of human resources for science are also being discussed. These include initiatives to create “mirror” university laboratories in the regions aimed at exchanging experience between leading and “catching up” universities, as well as proposals to increase salaries for highly qualified scientists who are in demand on the international labour market. Reorganising the system of postgraduate education in Russia with the improvement of training of academic personnel in postgraduate courses has been another important focus of national research policy.","The Strategy for S&T Development of Russia, which was adopted by the President in December 2016, defines the grand challenges for Russia: decreasing opportunities of economic growth based on exploitation of primary resources; ageing of population, and new social and healthcare problems; food security and food independence; increase in importance of energy supply; external security threats; and the necessity of effective exploration of territory. 

The Strategy should meet these grand challenges through the implementation of R&D and innovation projects and programmes within the S&T priorities of Russia. For example, the recently adopted Federal S&T programme for the development of genetic technologies up to 2027 is aimed at responding to a number of grand challenges including health problems, food security and environmental sustainability. The role of science and technology in response to social challenges has been emphasized in a number of policy documents. However, there is a clear need for policy makers to better strengthen the linkages among the grand challenges and particular STI policy instruments, as well as to translate the grand challenges concept into particular policy actions.",
